{
  "$schema": "./foundation-content.schema.json",
  "schemaVersion": 1,
  "title": "LK Design System Foundations",
  "completionCriteria": [
    "purpose-and-principles",
    "semantic-model",
    "selection-criteria",
    "quantitative-rules",
    "do-dont",
    "exceptions",
    "accessibility",
    "internationalization",
    "lds-examples",
    "token-api-links",
    "machine-readable-reference"
  ],
  "foundations": [
    {
      "slug": "design-token",
      "title": "Design Token",
      "status": "current",
      "purpose": "LDS의 시각 결정이 코드·Storybook·Figma·AI 출력에서 같은 의미를 유지하도록 primitive, semantic, component 계층과 runtime projection을 관리합니다.",
      "principles": [
        "제품은 값이 아니라 의미 역할을 소비합니다.",
        "하위 계층의 값은 상위 계층 계약을 우회하지 않습니다.",
        "토큰 변경은 영향 표면과 migration을 함께 기록합니다."
      ],
      "semanticModel": [
        [
          "Primitive",
          "원천 스케일과 브랜드 값"
        ],
        [
          "Semantic",
          "제품에서 사용하는 의미 역할"
        ],
        [
          "Component",
          "재사용 컴포넌트의 안정된 계약"
        ],
        [
          "Runtime projection",
          "CSS와 패키지 산출물"
        ]
      ],
      "selectionCriteria": [
        [
          "일반 제품 UI",
          "semantic token",
          "primitive 또는 raw literal"
        ],
        [
          "공용 컴포넌트 내부",
          "component token",
          "화면별 임시 변수"
        ],
        [
          "새 값이 필요함",
          "기존 역할·alias 가능성을 먼저 검토",
          "이름만 다른 중복 토큰"
        ]
      ],
      "quantitativeRules": [
        [
          "Theme modes",
          "모든 semantic color는 light/dark 값 필수"
        ],
        [
          "Naming",
          "kebab-case CSS, 역할 중심 JSON path"
        ],
        [
          "Lifecycle",
          "proposed → active → deprecated → removed"
        ]
      ],
      "doDont": [
        [
          "Do",
          "surface/card처럼 목적을 표현합니다."
        ],
        [
          "Don't",
          "blue-500처럼 시각값을 제품 계약으로 노출하지 않습니다."
        ],
        [
          "Do",
          "변경과 함께 Storybook 영향 예시를 남깁니다."
        ],
        [
          "Don't",
          "generated CSS만 직접 수정하지 않습니다."
        ]
      ],
      "exceptions": [
        "외부 라이브러리의 고정 변수는 adapter에서만 허용하고 LDS token으로 위장하지 않습니다.",
        "실험 토큰은 proposed 상태이며 public component에서 소비하지 않습니다."
      ],
      "accessibility": [
        "대비·focus·target size에 영향을 주는 토큰은 해당 접근성 gate를 통과해야 합니다.",
        "색·motion 토큰은 단독으로 의미를 전달하지 않습니다."
      ],
      "internationalization": [
        "토큰 이름은 번역하지 않지만 description과 example은 한국어·영어 소비자가 이해할 수 있게 작성합니다.",
        "locale별 값이 필요한 경우 이름을 복제하지 않고 mode 또는 제품 formatter를 사용합니다."
      ],
      "examples": [
        [
          "상태 텍스트",
          "status-negative-text와 status-negative-surface를 함께 사용해 신호색과 읽기색을 분리합니다."
        ],
        [
          "컴포넌트 추가",
          "primitive를 직접 참조하지 않고 component token이 semantic role을 alias합니다."
        ]
      ],
      "tokens": [
        "tokens/source.json",
        "tokens/*.css"
      ],
      "apis": [
        "styles.css",
        "npm run check:tokens",
        "npm run check:colors"
      ],
      "sources": [
        {
          "label": "LDS token governance",
          "path": "docs/TOKEN_GOVERNANCE.md"
        }
      ]
    },
    {
      "slug": "color",
      "title": "Color",
      "status": "current",
      "purpose": "색을 장식이 아니라 surface, foreground, border, action, status, data visualization 역할로 사용하고 모든 theme에서 의미와 대비를 보존합니다.",
      "principles": [
        "역할이 값보다 우선합니다.",
        "상태는 foreground·surface·border·text의 묶음입니다.",
        "상태와 데이터 범주는 서로 대체하지 않습니다."
      ],
      "semanticModel": [
        [
          "Atomic",
          "팔레트 생성용 원색"
        ],
        [
          "Semantic",
          "background·label·line·status·data-viz 역할"
        ],
        [
          "Component",
          "컴포넌트별 안정 alias"
        ],
        [
          "Mode",
          "light·dark·auto"
        ]
      ],
      "selectionCriteria": [
        [
          "본문과 라벨",
          "label-strong/normal/neutral/alternative",
          "assistive/disable을 필수 텍스트에 사용"
        ],
        [
          "상태 문구",
          "status-*-text + status-*-surface",
          "선명한 signal 색 위 흰 글자"
        ],
        [
          "차트 계열",
          "data-viz-series-*",
          "positive/negative를 단순 범주색으로 사용"
        ]
      ],
      "quantitativeRules": [
        [
          "Text contrast",
          "일반 텍스트 WCAG 4.5:1 이상"
        ],
        [
          "Focus/non-text",
          "필수 시각 경계 3:1 이상"
        ],
        [
          "Status",
          "색과 텍스트 또는 아이콘을 항상 함께 제공"
        ]
      ],
      "doDont": [
        [
          "Do",
          "상태 surface·border·text를 같은 tone family로 조합합니다."
        ],
        [
          "Don't",
          "한 상태색 하나를 배경·글자·테두리에 반복하지 않습니다."
        ],
        [
          "Do",
          "light/dark 양쪽에서 실제 조합을 검증합니다."
        ],
        [
          "Don't",
          "atomic palette를 component에서 직접 참조하지 않습니다."
        ]
      ],
      "exceptions": [
        "브랜드 로고처럼 고유색이 식별 의미인 자산은 승인된 color icon으로 유지합니다.",
        "disabled 표현은 핵심 정보를 전달하지 않는 경우에만 낮은 대비를 허용합니다."
      ],
      "accessibility": [
        "색만으로 상태·선택·경로·심각도를 전달하지 않습니다.",
        "대비 gate가 없는 새 조합은 public contract로 승인하지 않습니다."
      ],
      "internationalization": [
        "색 이름으로 지시하지 말고 위치·기능·상태 이름을 사용합니다.",
        "문화권마다 다른 색 의미를 안전·오류의 유일한 단서로 사용하지 않습니다."
      ],
      "examples": [
        [
          "장비 경고",
          "negative surface + text + triangle icon + '연결 끊김' 문구"
        ],
        [
          "차트",
          "series token과 Legend의 shape/dash label을 함께 사용"
        ]
      ],
      "tokens": [
        "--color-atomic-*",
        "--color-semantic-*",
        "--component-*-bg/fg/border"
      ],
      "apis": [
        "npm run check:colors",
        "stories/Foundations.stories.jsx"
      ],
      "sources": []
    },
    {
      "slug": "typography",
      "title": "Typography",
      "status": "current",
      "purpose": "글자 크기보다 정보의 역할과 읽는 순서를 먼저 정하고, 한글·라틴·가나가 같은 위계와 리듬으로 읽히도록 합니다.",
      "principles": [
        "semantic text role을 우선합니다.",
        "같은 역할은 화면이 달라도 같은 스타일을 유지합니다.",
        "밀도를 이유로 가독성·행간·확대 대응을 희생하지 않습니다."
      ],
      "semanticModel": [
        [
          "Display/Title",
          "페이지와 핵심 표제"
        ],
        [
          "Heading/Headline",
          "섹션과 강조 본문"
        ],
        [
          "Body",
          "일반·reading 본문"
        ],
        [
          "Label/Caption",
          "control·metadata·보조 설명"
        ]
      ],
      "selectionCriteria": [
        [
          "페이지 제목",
          "Title",
          "임의 bold+font-size"
        ],
        [
          "긴 설명",
          "Body reading",
          "Caption으로 축소"
        ],
        [
          "수치 강조",
          "Display/Title + 단위 Label",
          "값과 단위를 한 문자열로 동일 크기 처리"
        ]
      ],
      "quantitativeRules": [
        [
          "Scale",
          "16 semantic styles"
        ],
        [
          "Body",
          "기본 15–16px, 22–24px line-height"
        ],
        [
          "Narrow",
          "텍스트 확대·긴 번역에서 clipping 금지"
        ]
      ],
      "doDont": [
        [
          "Do",
          "제목→본문→메타데이터의 role을 DOM 순서와 맞춥니다."
        ],
        [
          "Don't",
          "시각 크기만 맞추려고 새 pixel 값을 만듭니다."
        ],
        [
          "Do",
          "실제 한글·영문·숫자 샘플로 확인합니다."
        ],
        [
          "Don't",
          "placeholder나 caption에 필수 지시를 숨깁니다."
        ]
      ],
      "exceptions": [
        "데이터 테이블의 숫자는 tabular numerals를 사용할 수 있습니다.",
        "코드·식별자는 mono font를 사용하되 설명 문장까지 mono로 바꾸지 않습니다."
      ],
      "accessibility": [
        "200% 확대와 320px에서 내용 손실이 없어야 합니다.",
        "heading level은 시각 style과 독립적으로 올바른 문서 구조를 유지합니다."
      ],
      "internationalization": [
        "Pretendard JP fallback으로 한글·라틴·일본어를 확인합니다.",
        "언어별 줄바꿈과 단어 길이가 달라도 고정 높이로 자르지 않습니다."
      ],
      "examples": [
        [
          "운영 카드",
          "Title 3 제목, Body 2 설명, Caption 1 freshness"
        ],
        [
          "계측값",
          "Display 3 값, Label 1 단위, Caption 1 기준 시각"
        ]
      ],
      "tokens": [
        "--display*-*",
        "--title*-*",
        "--heading*-*",
        "--headline*-*",
        "--body*-*",
        "--label*-*",
        "--caption*-*"
      ],
      "apis": [
        ".type-*",
        "stories/FoundationsTypography.stories.jsx"
      ],
      "sources": []
    },
    {
      "slug": "iconography",
      "title": "Iconography",
      "status": "current",
      "purpose": "기능·상태·탐색 의미를 일관된 glyph와 이름으로 전달하고, 새 그림을 만들기 전에 공용 registry를 재사용합니다.",
      "principles": [
        "이름은 모양이 아니라 의미를 표현합니다.",
        "monochrome glyph는 currentColor를 상속합니다.",
        "아이콘은 텍스트를 보조하며 접근 가능한 이름을 중복하지 않습니다."
      ],
      "semanticModel": [
        [
          "Normal",
          "일반 action·navigation·status glyph"
        ],
        [
          "Color",
          "고유 색상이 식별의 일부인 승인 브랜드 자산"
        ],
        [
          "Robotics extension",
          "일반 registry에 없는 로봇·지도 의미"
        ]
      ],
      "selectionCriteria": [
        [
          "본문과 함께",
          "16–20px",
          "아이콘을 별도 제목처럼 강조"
        ],
        [
          "버튼/목록",
          "20–24px",
          "행간보다 큰 glyph"
        ],
        [
          "독립 상태 그림",
          "24–40px + visible label",
          "색과 모양만 제공"
        ]
      ],
      "quantitativeRules": [
        [
          "Approved sizes",
          "16·20·24·32·40px"
        ],
        [
          "Touch target",
          "아이콘 크기와 별개로 최소 24px, 주요 touch control 44px 권장"
        ],
        [
          "Source",
          "manifest와 generator를 통해 추가"
        ],
        [
          "Stroke thickness",
          "외곽선 글리프는 24 그리드에서 1.5–3 (base 중위값 2.25). check:icon-drawing-style이 검사"
        ],
        [
          "Ink coverage",
          "외곽선 글리프는 36% 이하. solid는 -fill 이름을 쓰거나 SOLID_BY_DESIGN에 등록"
        ]
      ],
      "doDont": [
        [
          "Do",